rating,reviewContent
3,"The courier didn't confirm before sending, you know, when sending remote items, it hasn't been damaged"
3,"slow item, digital blurry image, on, the image is not clear, the condition of the item, the seal, the item is used"
3,good stuff low price cm minus bright screen can't soft can read flash can read hdd flash gb subtitle can't set neighbor's tv
3,"the price is pretty good, the Google Play Store application is a little rich on Android"
3,"Thank you, bro, the item arrived quickly yesterday, I hope it will last"
3,great
3,tv received mes condition using wooden pegs
3,"cool body, color image quality"
3,normal warranty card or not
3,ok
3,"well, the price is quite that much, the picture is clear, dark contrast, I've set the contrast, it's still ok, the packing is neat, hopefully it lasts"
3,"The laptop is in good physical condition, when it turns on, Excel Word opens, turns off, tries to blank, doesn't show chat, reply, I'm back home from warranty claims, thank you Lazada has helped with the return process"
3,file read file saved flashdisk results remaining entered file name failed to input flashdisk
3,standard
3,alhamdulillah sent a message for excellence conditions try to test record data results thanks yaa team lazada special gift thre tumble up
3,klo credit gmn ny
3,"the goods are okay, the speakers are quite certified, Netflix, but my main goal is to buy an Android TV, maybe I'll be careful before buying, I'll see the Netflix review, it's just inches"
3,"I'm glad the TV is on, how about the remote, how about it, admin, give me a solution"
3,stuff install windows
3,"the price is quite competitive, the delivery is fast, the product doesn't smell good enough"
3,reasonable
3,I'm sorry I haven't arrived yet using the line
3,overall smart tv lite coocaa choose smart frills for its features thanks coocaa
3,good item fast delivery good packing bargain
3,sound picture pass the price
3,no stock bro
3,send disappointed image image sandisk flash disk cruzer switch send sandisk flash disk cruzer edge let me know the stock is out cruzer edge flash model thank you
3,"good stuff, packaging doesn't use wood, bubble wrap. When the box is opened, the foam is broken. Check the item. Disappointed. The lazada system is installments. Trying to reinstall the CS app twenty times doesn't make it frustrating, the price is skewed, does it make you pay in full?"
3,first test level yes
3,"hold the data after saving on TV, sometimes the video crashes and doesn't play"
3,order blue color send black color ya wis
3,"the tv is okay, it's safe, good, the lazada system is weird, the order is nov until nov, on nov, the email is received, even though the bomb came, panic, report cs"
3,fast delivery cheap good stuff thx lazada
3,"it's great, just no notes"
3,I hope it's a bargain
3,"thank you, package received, quality of goods, okay, you know, don't expect it to last, honey. Sending orders for goods, sending plus sending receivers, total receiving work goods, seller response, seller conscientious about customer service. hope there is a quick response, thank you"
3,usb classic design okay quality
3,frustrated
3,"sir, please order the name Ahmad Abidin, cancel it, mf, yes before"
3,how about small
3,goods according to the description sent to sell
3,stuff install windows
3,"the product is pretty good, the vendor just sent it"
3,barangx sdh thanks lazada
3,"Sending goods, estimated delivery after arriving, forced to take the warehouse jne"
3,"good stuff, peking neat, I really recommend if the goods are just a shame, send it like dregs, jne oper my stuff, it won't appear first, cs, if you understand, it's better to send it better"
3,enough flashdisk doesn't work
3,original
3,"send it neatly according to the picture, quickly send it like it"
3,please change the subtitle information
3,send goods to different flash images
3,"Dear item, the softcast puch is small"
3,flash dishny for zenfone go gk phone
3,flashdisk okay already received bsu
3,mw you lg
3,"the laptop turns on, the information appears, the Windows installation has failed again, wait for the seller's response, send the Windows screen, bring the exchange item"
3,"the price always changes hahaha the goods are okay, the screen is sharp if you use a button panel antenna like a cheap TV, the price doesn't lie, I pray that it lasts"
3,sliding dragging goods
3,buy notebook notebook charger cd driver warranty card mouse bag price tera
3,"The flesh is light, the truss isn't dense, I can only read gb, if I use it, I plug in the computer, I receive the data, I send the HDD, when I copy, I see it's safe, it's good, it's pretty good, I added lalod, I checked the file, it's already filled, it doesn't appear, it doesn't appear like it won't respond, so when the copy is finished, I feel like I'm done flesh lalod responds quickly to me flesh sandisk gb if the contents of my film data pile up open the response it's really fast I don't experience it just now the core is natural use send good packing seller is friendly, the response is fast, thanks adata"
3,sell windows clear windows people mean easy to install windows
3,"I have received the Flasdis packaging, but the plastic is not the manufacturer's box, hopefully the error will last, saving my work data"
3,West Bogor area cod goods
3,"It's super fast, just send it, but it doesn't pack wood, the VIP card doesn't match the promo, it's hard to contact CS, but overall it's worth it"
3,"the hdd body is good, the hdd has lasted until now"
3,"play the video, the picture is okay, it's pretty good, it's not full HD"
3,gb okay saving mp movie tide tv doesn't show up
3,"According to the description of the joystick, the promo photo is packed through"
3,Dare to class electronic goods send plastic wrap wrapping overall good
3,"Good stuff, now I'm hesitant to take it digitally, if YouTube doesn't get dvb t, hadehhh, if you don't add money, buy a set box again, ask the seller to respond, the buyer is honest in trading"
3,fast delivery according to the message good goods quality perfect goods gbr maximum crackle sound set music
3,"I want to order the packaging if it's neat and safe, the item is protected by the star, if the item has been received by the star"
3,good stuff fit
3,neat packing try
3,"Thank you very much, it arrived as estimated"
3,sony ads appear really panasonic inc inc
3,package of goods ok friendly courier spoke on the phone no sent goods did not match the pick-up address
3,"The item has been received, disappointed, save the data"
3,"gold is neat, the flash is functional, thanks lazada"
3,"the laptop is ok, the price is ocher plus you can get a backpack too, thanks lazada"
3,"Satisfied with sending goods, ESL Express, sending Jakarta, transit, Palembang, directly to Bengkulu"
3,"cm use bubble wrap selap packing wood worry because it's different from the island of East Kalimantan but open the normal box free backet bullshit promo price free bracket rb price lg promo cut rb price free bracket just delete it Boong wkwkwkwk dolby audio sprtinya cm gimmick audio cm bs mono just try to find it the stereo settings can't use the manual book, the TV speakers don't have good sound, use external speakers, a soundbar so the sound is pretty good, clear, the screen is still from Japanese brand TV, well, the price isn't too bad, I hope the TV is safe, thanks"
3,buy rb lazada original sandisk goods order home free postage thnks lazada
3,"the goods according to the message, received according to the schedule, unfortunately, there is a wrong perception, carefully read the specifications for the item, the sata hard drive needs an ata hard drive"
3,finally send send package
3,quality originality ok item send ninja express wait send more estimate
3,please notify
3,cracked screen forced back
3,item thank you lazada fd gb error can't read thanksgiving cman bonus luckily gb didn't read otg moto g s plus maybe it doesn't support or what about the price
3,the product is a star thumbs up fast delivery good lazada crew thanks yak coocaa thanks yak nahhhhh gk bintang service center c a c a t
3,fast package neat packing smooth item thank you lazada
3,good stuff thq
3,the goods according to oben's description in so far sent according to the complete estimation good
3,until the response is automatic system
3,how about lazada credit
3,"it's good, I like it, fast delivery, thanks"
3,"try, ok, no problem, maybe the house is z"
3,"Order services, etc. Problems don't deliver, send messages for ninja express services, please pay attention to the delivery service, disappointed customers are disappointed"
3,bought two million tv yesterday check hahaha
3,price range good quality
3,"TV is great, fast delivery, catchplay hooq iflix, how come or not, how about the settings, the download doesn't finish even though I'm connected to wifi"
3,"Order messages at Lazada, never disappointed, disappointed product sent"
3,package received expedition constraints send week confirmation status
3,"when the goods are good, how come they are complete original, thx lazada"
3,"gada polite courier turns ksh money pretend friendly hahahaha cool, the package is neat"
3,goods according to order
3,cant save video
3,the item doesn't match the picture or the cd rw
3,quite according to the description
3,"according to the cheap price, it's really slow, because I still can't send it safely"
3,"until waiting for the week when the goods arrived just in time to go buy them, the goods are in accordance with the pictures, the contents are neat, or not, gb, thank you lazada"
3,good for the price
3,reasonable
3,item ok slow shipping
3,"Goods received Sunday afternoon, decent fast. Please consider lg, safe packaging. Goods"
3,"I've received the packaging because it's safe, there's a risk of damage, because for gifts, you can't dare to try it, so far fine, review the product next week, after receiving a gift, add a free voucher, hooq."
3,otg flash drive
3,Goods arrived late estimated hard antem operators overall satisfied with shopping at Lazada the land tv is perfect in okay condition Cheap TV is great if you say cheap TV is not cheap Credit appreciation point lazada is responsive to customer complaints
3,the tv is small or not
3,cd driver
3,"buy a usb otg cable, it's pretty good, the photos don't read"
3,"it's good to use electricity, it's hard to carry it"
3,"the packing is good, but when transferring data from a sandisk sd card"
3,"The photo does not appear to match the type of TV, according to the type of delivery, according to the description of the item, according to the description of the item, the photo is disappointed, the item was sent quickly"
3,send
3,quality send purchase receipt invoice how warranty claims
3,light thin
3,it's ok
3,capacity according to PC properties
3,"Thank God, the package was neat, the courier, the goods were disappointed, they didn't save"
3,"ok, the service is fast, the response is immediately sent according to the estimate, send a friendly courier anyway, ok lazada"
3,"stable, fast payment, according to the picture, the function of the Lazada slider"
3,product quality lower price appeal please name philips
3,"how about the laptop volume cable or not, bro?"
3,pretty ok
3,"Chinese production, not the official Asus laptop, has tested less, it takes more time for OS Endelles, due to not supporting the general installation application, Word, Corel, etc., I don't replace windows, thank God the CPU is full, the laptop still has a heavy screen, the performance is really good, the cardboard seal, open the official laptop bag belonging to Asus, the warranty is cm, while Asus is it's official, so you can think about it first, if you buy a laptop, look at the shop, exchange it, I'll pack the goods intact, thank you"
3,"cheap price, okay quality, the goods have arrived in the Sumedang area"
3,send fast
3,"Disappointed to buy a bonus bracket promo when the goods arrive, a promised bracket bonus"
3,goods arrived
3,flash disk is good
3,"neat packing, good stuff, note, moving the channel, second channel"
3,physical goods ok subscription voucher hooq send promise
3,"good, unique, unfortunately the laser pointer is bright, right according to the price"
3,according to solid specifications
3,tv accept then use lazadacare app
3,"not bad, the price for the com cri graphic promo is a smart tv, I bought it, the function is okay, I hope you can take care of it quickly"
3,goods have checked the goods of the house
3,"Good item, safe condition, shipping, really annoying, jne, used jne, doesn't move, just like the Lex courier package, it's like the product has already been reviewed because the box is open in the middle of duct tape, it looks like the original brought the factory"
3,"good stuff, I like it"
3,"Samsung tv, computer monitor or not"
3,"good stuff, cheap price, loyal lazada subscriber"
3,"The gb fd is damaged, I can't use it, please send it again"
3,"doesn't match the photo, I'm afraid to buy it, I'm afraid it won't match the photo of the item"
3,"goods according to the price of the file, yes"
3,"it's good as expected, no regrets, no disappointment, buy it too, thanks seller lazada"
3,untest sound
3,I think the charger is Mi Thuny Samsung
3,"quality according to price, please hold on"
3,maaf port u s b ga
3,"Flashdisk sometimes sometimes doesn't, even though it measures according to the picture"
3,thanks lazada the package to buy a tv for disabled
3,use x don't just read
3,"weighing the price of cheap tv specs in terms of value comparison in terms of complete features smooth menu operation fast lag smart tv sony use testing hdmi port k output k support hdr hdr support p disappointed tool ngaco output cable tv hdmi normal function sound picture tv cable output p means good facts tv p sony sony ps function hdmi port limit k hdr top graphic quality k ps set manual k yuv mode select auto select k rgb green spot screen dark screen select mode result good picture happy with bad sound bass sound frequency close hearing error restart times hdr feature the function of the color of the shadows is disappointed, the dark corner of the light, the LED is flat, the panel in terms of competitive prices, the price of a K-led LED TV, close to the price of a Coocaa TV"
3,"How come it arrived, sis. If I send it, how come it's damaged or broken?"
3,send package fast day direct message send position digressic card smartfren bonus lazada anti card
3,"it looks pretty bright, the seller is responsive even though it's a lot of replies hehe I love the power button vol do socket charger on the side it's weird it's not normal for the screen to scratch easily like I don't know if the bottom layer is lg or not I can't use it but it's blurry the screen contents of the tablet are empty so it doesn't even have google installed I'm low on stars because of capacity rom gb save the remaining data still gb can't save it again the error message appears insufficient space"
3,"don't fill the tar box, just the laptop"
3,"Flashdisk error entered the PC, the data was immediately corrupted"
3,packing ok
3,"ryzen guys, according to expectations, please take responsibility again"
3,sen blue color love red install windows touchpad function looking for drivers
3,please confirm the courier nyaa goods thank you
3,"I received the Smart TV, it arrived, I took it, because it lacks UHD TV, not on TV, as in TV promotional advertisements, as well as the Google Play application, the incomplete limit, aka the Google Chrome application limit, no UC browser, no additional application sets, a little bit disappointing, because the Inch TV is cheap, it's Android treat disappointment tks"
3,flashdisk file format one over gb format fat
3,item received last june no bonus otg
3,"defects, scratch function"
3,order quickly send brang ok bonus damaged name yes bonus hehehe thank you lazada
3,"neat packing, fast delivery, the screen is pretty good at that price"
3,"the product is pretty fast, it's a shame that Windows installed genuine fake activation, it's easy, because the motherboard was replaced, so it's used so far so good, you have to activate Windows, if not, don't personalize your PC"
3,terang speed rpm kirim hd pipeline
3,nicess good packing
3,"review factor, fast delivery, order oct date, oct date, on hand, product defect line, death pixel, respone, live chat, quickly discuss the item, unfortunately, you can't exchange the product, refund the product, lazada check product, oct. Just send it to minimize the return of electronic products"
3,wait for the item
3,lightweight patents
3,the item according to the image cm process of copying the agk file
3,fast neat packing
3,"alhamdulillah, the item has been received, it's easy and durable"
3,"Thank you, Kenkez sells lazada Indonesia. Goods received quickly. O Courier Lex. Simple packing"
3,delivery goods
3,"tv so far it's good, I'm a bit annoyed when I send it really day because the expedition wasn't careful, Lampung strayed from Jogja, just be careful Lazada choose the expedition to send the goods disappointed packing without using wood packing"
3,product ok weak read tablet asus
3,ckp
3,cracked lcd goods don't use send lazada thank you lazada shipping fee is lazadaa's responsibility
3,minimal information on rim no receipt when checking doesn't match the information when checking cs ninja xpress packing ok
3,"The description of inches, yes, I want to exchange, wait for my child, I'm looking for this, I haven't checked the ROM RAM according to the description or not"
3,slot usb service only alias putar multimedia foto video
3,tv sunday not send level pay attention according to estimate thanks
3,hope the test is good for it
3,"beg the dealer to subscribe, tell me, send it, it's understandable, the goods have been received, neatly packed with wood, thank you"
3,"it's good to buy if you wait until at least a week, if you're still looking for a star"
3,no warranty card
3,how about gb capacity yes order gb
3,pretty good
3,neat packing fast delivery
3,"Alhamdulillah, the brang is safe and tidy, I hope it's like this"
3,seller ok usb kenal win win cek device manager baca cicada flash reader usb device detect
3,laptop cake likes it
3,good according to cellphone input function
3,"there, trima rda at the time, trima brang neatly wrapped in wood"
3,flashdisk hp
3,"thank you, the item arrived quickly, it didn't match the contents, it didn't arrive"
3,The small pouch does not fit the hard disc
3,may it last
3,"sent super from May, ordered until May, even though I only sent Padang goods, I tried and there was no problem"
3,damage
3,according to message
3,"fast delivery, good item, clear sharp picture"
3,deliberately amnil large small
3,smart tv android oreo google assistant thin bezel good connectivity according to picture quality compared to brand tv
3,error song content
3,Is the voucher cut or not?
3,according to the price of quality murmer
3,"the original product is okay, I'm confused about the installation, I'm disappointed, the color of the message doesn't match the message, blue comes black, hopefully it lasts, no problems"
3,"more packing of wood, less delivery, subject to shipping costs sixty thousand rupiah x hundred thousand rupiah, the charge for shipping costs an expensive hundred and ninety thousand rupiah"
3,good stuff nicely pack it just send it thanks ya
3,good product packing using bubblewrap not packing wood
3,bought two million tv yesterday check hahaha
3,dear free bracket
3,item according to the description bonus flashdisk according to the description of the item smooth yahh beret performance windows pretty decent streaming youtube lot still a bit broken buts its ok the price of gin the quality is according to the price yeah
3,item received when open seal package open warranty card speculation contents hopefully hdd problem
3,"sent super from May, ordered until May, even though I only sent Padang goods, I tried and there was no problem"
3,goods sent for
3,It's been broken for less than half a year
3,"It's been a week since the goods arrived, I was afraid that the goods would not arrive at home"
3,"The goods are safe, the bubbles are torn torn, it makes me disappointed. Estimation of sending. Please send the items estimated."
3,"When I buy a cheap online laptop, the AT button doesn't write the email symbol, the lazada system, press appears, press appears, the at button is really pegimane, if I return, it passes, qc is disappointed, Asus unloading center"
3,data transfer okay capacity
3,"Fast delivery, neat packaging, item according to the picture, thank you Lazada"
3,"Original item, good quality, slow delivery"
3,"The package is slow to order thursday night tuesday evening br junior high school jne the product has a flat blue line after putting it back, fortunately it's gone, then claim the warranty, what about the warranty card, no stamp, no purchase receipt"
3,HDD is in accordance with the bonus specifications according to the tera Lazada has confirmed CS ordered to send proof where the evidence is not sent.
3,hdmi support
3,thanks
3,Disappointed sent Sunday no confirmation from seller sent tv
3,stuff install windows
3,"Express doesn't come, it still pays standard shipping, it's free"
3,"in a hurry, I need to check cheap competitors, sob"
3,Items in the Fast Windows Trial category
3,"genuine holographic product, warranty card, bright box, original official Indonesian goods, warranty, telephone number, service center, available memory, tb, tb difference, the difference is very different, using an external system, a good hard drive, fast, a good hardcase gift, protects goods against dust, unfortunately, the official web registration wd identification number, the identification number is valid, aka the original item, aka kw the seller is responsive, dear, tell me that the goods are not original"
3,how about lazada credit
3,deliver
3,sen
3,"good stuff, it's a shame the cover didn't send the cover picture though"
3,goods received received goods good check not goods direct give doorprice client
3,"packing neatly using only bubble wrap congratulations to go product display picture different original unit because inch display shop window version inch see different foot model chromecast smartphone uses thick thin bezel net cm image of broken shadow play video quality k fast open youtube it's just really complicated etiquette for sound booming loud volume os using coocaa lite os reasonable because android if android buy android tv box side picture yes because only hd picture quality there is send date sept mes direct entry process courier sorting station ninja xpress date sept cs goods ambon air way sept date cs says goods ninja xpress warehouse jakarta, you say v way oct date goods status change hold complaint order wait x hours reschedule oct date goods arrive Ambon hold warehouse ninja xpress embarrass oct date goods arrive hand core service ninja xpress slow obviously cs goods receive deadline estimated date of october delayed October date is late Sunday please like like review"
3,item received last june no bonus otg
3,laptop notebook
3,It's neat and tidy. It arrived quickly. I hope it will last a long time. Thank you Lazada
3,goods
3,"yes, it's slow after typing, all that's left is the internet letters until it's boloty, just won't screen, it's a shame it's running out of pros a"
3,the item matches the picture exactly not oval widescreen
3,laptop description plus warranty please
3,"the goods received, the tool fits great, thks"
3,"pretty good quality, deliberately give a star"
3,"I apologize for reviewing different branded items, order the wd brand transcend"
3,sen
3,good stuff dear send it like a pler jne den ninja van need it fast
3,really sent the estimated date the courier didn't come home took the capacity package but that much I was disappointed anyway it's okay I hope it lasts really neat packing thanks seller thanks lazada
3,normal stuff okay
3,send it fast thank you
3,happy to understand
3,beda order
3,Animated films according to the expectations of children pull. Real animated films. Pulling pictures display messages that impress children. Innovative drag
3,laptop received good packing defect thankslazada
3,"lack of features, Android TV is not optimal, can't search the Google Playstore application, download, install the app, ready, can't the dedicated remote button, print u voice, Google Assistant, doesn't function, quality specs, K HDR, doubt, can't edit subtitle color, more worth the price, jt an u, uk can broadcast digital, dvbt analog, sdh wifi bluetooth built in chromecast slot usb hdmi loud sound"
3,the item doesn't match the graphic description it's not dedicated I received the shared hdd from the description only an gb dr tera like the description but disappointed but sent fast order late afternoon arrived
3,dtp hdmi apparently not
3,mantul not full cheap not cheap
3,"according to the cheap price, it's really slow, because I still can't send it safely"
3,"good, the goods don't match the ad capacity when the tester is gb gb"
3,"Send it really, really use the South Tangerang area. Professional courier. Receipt number. Track the official website. Report cs. Lazada."
3,don't read after yrs please
3,"fast delivery, good item according to the description, send data fast, fast heat, just take a few minutes"
3,quite a price like that
3,"Chinese production, not the official Asus laptop, has tested less, it takes more time for OS Endelles, due to not supporting the general installation application, Word, Corel, etc., I don't replace windows, thank God the CPU is full, the laptop still has a heavy screen, the performance is really good, the cardboard seal, open the official laptop bag belonging to Asus, the warranty is cm, while Asus is it's official, so you can think about it first, if you buy a laptop, look at the shop, exchange it, I'll pack the goods intact, thank you"
3,fast stuff measure the flash disk gb
