rating,reviewContent
3,"The screen is broken, just pack it with bubble wrap, just wait for it to break"
3,"Monday Monday directly process lazada Tuesday morning Dakota Cargo I'm waiting until Friday evening I haven't received the goods yet, be patient, be patient, if you are crossing the island, it's only natural to send a used one, just spend it patiently"
3,usb photo clear usb description
3,land parcels dear electronic packages between motorcycles overlapping the core goods disappointed send more the best grandson palace room
3,laptop notebook
3,"If this is a factory seal, how come you can't find it in pieces, yes, the dust on the TV is a little simple, it's easy, it's easy to last"
3,"How's the cicil, sis?"
3,The hdd pouch stuff goes into the hard disk when the other one is good
3,picture breaking
3,pack it thick to be safe
3,products with original deliver to the house pay lazada place thanks let me subscribe
3,fast process
3,criticism
3,"buy cod, physical condition, safe, neat, packing using bubble wrap, random error, picture of the tv antenna, it doesn't connect, so just watch via wifi, live channel claim warranty, xiaomi service center, quite a distance, house, shop, responsibility for error system, change price, fast, order k, pay date, courier, check price, already done, date flashsale date maybe lower price but of for all love this smart tv"
3,original gb stuff pretty fast save data
3,thanks lazada flashdisk how come you don't regret shopping lazada
3,disappointed taro courier price thousand
3,"It's not bad if the remote is lost, it doesn't use it, it just has an on off button, TV ad smartphone supports TV"
3,let me try to review if I've used it to appear sis
3,the tv is soft like crackers
3,"When I buy a cheap online laptop, the AT button doesn't write the email symbol, the lazada system, press appears, press appears, the at button is really pegimane, if I return, it passes, qc is disappointed, Asus unloading center"
3,item arrived safely
3,nice wait
3,"the goods are ok, thank God, they are smooth, the defects are hopefully durable, you can get a cheap price, add a discount, use the kk city, the seller sends it because when a few Eids buy it quickly, it's also sent by the shipping service. lg the address of the goods alley, not dropping off the house, picking up and transporting goods, said the courier didn't look after the car at the house, from the gang, bought a washing machine, delivered it to the front of the house, negotiated, forced to deliver, looked sullen, gave tips. Call your girlfriend impolite if you call her it's really difficult, said her activities, on a cell phone, please consider Lazada electronic delivery service"
3,"it's good, I chose the wrong USB"
3,"TV is good, great. Recommendations for fast delivery. Order in the morning. Send it straight away. Disappointed. Packing using wood. Luckily it didn't crumble to Sumatra"
3,okay product send pretty good wooden packaging bubble wrap thanks
3,reasonable
3,sharp color easy menu operation
3,"ouch, how do you buy it, it's expensive, it doesn't work"
3,sen goods sunday received tuesday morning the packing was good I don't know when the write read test doesn't look like it's included when the write test reads just mb s ok please lazada be responsive
3,Disappointed packaging items were packed with wood after arriving in layers of dus
3,Disappointed packaging items were packed with wood after arriving in layers of dus
3,"Send fast, clear images, dominant red, set clean"
3,"the goods are okay, the goods are sent quickly, the packing is neat, but the problem is the keyboard, the keyboard doesn't sort the tap, the place is confused, the free headset when I check doesn't exist because it's really cheap, the goods"
3,good stuff waiting for a long time to cut Saturday Sunday rocking leg attach the nut hopefully it lasts waiting for the bonus
3,"good stuff, packing is safe, neat, original windows, send it using an express, an hour, an hour until it arrives"
3,"good product with additional functions, pay attention to the application, how long should you ask for the tv behind the usb hole, tv usb move"
3,"to be honest, the laptop is really a lot"
3,thanks lazada
3,hard to read files
3,send the ninja express oper hopefully it will last
3,"packing neatly fast when used to store slow data, bro"
3,"how come yesterday's price was cheap, how come it's different, the price of product a is good, no doubt, I hope the TV is good, there's no problem with the TV remote, amen"
3,product received week more estimated send it take expedition order transfer status message receive receive message no tracking receipt follow up lazada expedition no tracking receipt take goods expedition package function bonus laptop bag
3,ordered right on Nov. yesterday item received on Nov. fast normal already assembled bracket just now realized if meeting VIP card please clarify lazada setting tv is active set image bright
3,usb to led lights can not be used already damaged loose cover
3,decent quality for the price
3,"Installments are easy, the process is not difficult"
3,package of goods ok friendly courier spoke on the phone did not snap the goods sent did not match the pick-up address
3,not black stuff
3,"the hard disk is compatible, it's a shame the antivirus doesn't use it, it's already expired, if you tell me the activation date, the antivirus is a bonus, but I'm still disappointed"
3,tb capacity tb hope it lasts the seagate pouch package unfortunately the hdd won't fit don't use it then get a bonus seagate brand earphone it's a shame it's damaged don't use it
3,"How come it arrived, sis. If I send it, how come it's damaged or broken?"
3,Bintang because the antenna bonus was not sent to the TV unit yesterday when did you send the digital antenna bonus according to the specifications for selling goods
3,gb gb ok gpp good stuff fast delivery
3,"pack it ok, the original lacks the capacity to read the remaining gb or not"
3,"Goods received, distributor warranty, well, the goods are okay, good quality"
3,"Thank you, the packaging is neat, it's a shame the bonus isn't using the laser light"
3,no stock bro
3,Inc Inc is true
3,TV Garissa Hitam Horisontal
3,bag g
3,"the price is pretty good, hopefully the quality lasts"
3,warranty claim screen laptop
3,send fd message correct one mb
3,"Send gold color, give me red, dichat doesn't reply, send fast, cm seller is not communicative, haven't tried the item yet"
3,lazada success
3,good item flagship store thin packing sent disappointed
3,support hdr backlight bleeding plug four corners send picture quality sound ok native k product repaired a few less added suppprt hdr
3,gb flash disk function
3,thanks lazada item
3,"how come yesterday's price was cheap, how come it's different, the price of product a is good, no doubt, I hope the TV is good, there's no problem with the TV remote, amen"
3,
3,package received expedition constraints send week confirmation status package received package received
3,The ordered items came in white
3,"Good quality goods, couriers are slow, Cawak Ninja Express doesn't express"
3,"the packing is good, just black plastic wrap, the original UK is also not bad"
3,"Brg, haven't tried it, it's easy and good"
3,send laptop bag bonus tera title fill description send one item one after another just wait for action
3,according to the promo
3,"it doesn't fit, just write gb just check gb"
3,the goods received immediately the fake flash test turned out to be good results thanks
3,"thank you lazada, the goods received, the packing is good, neat"
3,sip
3,goods quickly gb capacity hopefully durable
3,great fast delivery goods ok
3,already ting yet
3,"great, bro, fast delivery, ordered good stuff, haven't tried it yet"
3,don't save a lot of files sometimes the file save save
3,good stuff
3,item okay process send status send tracking
3,it doesn't fit two gb lom try
3,code ga
3,"Goods received normally, data transfers are slow, normal, ori goods"
3,"months the TV is broken, just the sound"
3,original windows got a laptop bag with big ram but microsoft office donwload using polaris nice design dark blue color fast delivery packing very neat seal thanx lazada
3,"brg is not normal, I have continued to order canceled items"
3,"the remaining gb capacity, where the delivery is slow, according to estimates, the order is quickly canceled, sometimes"
3,flash drive that got a virus
3,late delivery ok quality ok price
3,ko capacity gb yes
3,fd pack
3,"The goods arrived quickly, unfortunately the booster antenna is not there, please be good at delivery"
3,came a different FD model
3,"it looks pretty bright, the seller is responsive even though it's a lot of replies hehe I love the power button vol do socket charger on the side it's weird it's not normal for the screen to scratch easily like I don't know if the bottom layer is lg or not I can't use it but it's blurry the screen contents of the tablet are empty so it doesn't even have google installed I'm low on stars because of capacity rom gb save the remaining data still gb can't save it again the error message appears insufficient space"
3,Intentionally misspelled title
3,"packing is good, packing is good, try it, it's ok, honey, fill in the ISO data, gb an not winrar, gb music video, buy ane coat video at gb ok"
3,"TV sent according to the description of the picture of the courier at home, I hope the TV will last, thank you Lazada"
3,doesn't fit until tb
3,mantabs ori goods send ninja express
3,satisfied product thanks
3,goods
3,"the otg cable is broken, bro, how come the plug doesn't connect"
3,"I still don't understand how to activate windows, don't fill it, it's a lie"
3,reasonable
3,fast send contents gb
3,goods according to the picture complete accesories txz lazada
3,flasdisk use copy data if it doesn't record data
3,That voice doesn't nahaaaaaaaaaaaaaaaaan wkkwkwkwk
3,product quality lower price appeal please name philips
3,tv received try the results according to the price send the expedition slow accept the order tomorrow accept it liaise the expedition
3,"hello, free hooq bln, where can I get information, please confirm, thanks"
3,what virus infected computers a lot
3,tv received in condition fast counting sending process dear bracket promise bonus
3,"The goods are safe, the ori package is really good, it's a shame, the package has been sent very well"
3,cheap fast good used space gb gb
3,reasonable
3,macbook pro retina laptop doesn't open huh
3,"the flash is good, the OTG cable has a slow sending function, the goods limit is okay, it's good"
3,please return the postage Rp same day service goods received late thank you
3,"installment, how do you use dp or not"
3,"Yes, the SD flashdisk is pretty good at that price, the size of the flashdisk is off the mark, I get a bonus voucher, it's pretty cash, the packing is neat, overall it's good, thank you Lazada Sandisk"
3,storage capacity gb gb
3,tv congratulations free hooq yes no free information please enlighten
3,thank you lazada good luck
3,wait for the week the goods are also the tv okay cm sound thanks lazada
3,according to message
3,"the goods came quickly, the packaging was neat, the goods were good"
3,"the zipper is disappointed, it's hard to open and close"
3,"it's pretty good to get a flash sale, a discount of thousands, but it's already digital, unfortunately the remote is responsive, supports Google Assistant"
3,item received function thanks lazada
3,"flashishx imud is good, haven't tried it, hopefully it doesn't crash"
3,good packing memory after check gb order gb
3,original
3,good
3,dear goods memory cm g thanks y
3,"Sorry, the warranty card is in a cardboard box, unfortunately it's not packed with wood"
3,"alhamdulillah, the goods are safe, the condition of the goods is good, I really like it, thank you, seller, Lazada, always successful"
3,dear function build quality
3,"Received the item according to the picture, the quality is okay, the price is cheap"
3,but kq pouchx lbih dri inside cntumkan or inside cmx cm
3,"Goods, the process of the package is good, dear, the gb gb according to the description, try again the gb format, please check again, send it, thanks"
3,"Good products, cheap orders, service workshops, East Java"
3,original windows got a laptop bag with big ram but microsoft office donwload using polaris nice design dark blue color fast delivery packing very neat seal thanx lazada
3,And in ke
3,"according to the picture, send fast, top"
3,"the tv is really cool, the packing is neat, safe, dear million, I'm sorry I'm disappointed because later I get more estimates on the order date, receive the date, des, jne, it's really good, when the item arrives, the info belongs to jne, t o p really"
3,please lazada good send fast
3,"The item is pretty good at that price, unfortunately, the lazada courier can't deliver to the house."
3,"cheap price, good quality, but unfortunately the invoice claims warranty"
3,laptop notebook
3,"The item matches the picture, misread GB to MB, I'm very disappointed, I'm sorry I didn't exchange it"
3,thanks siip try
3,ga
3,"The function is plugged in to the cellphone, I can't see the laptop, I'm a bit disappointed, thank you"
3,item ok dear send sunday
3,broken cable
3,reasonable
3,purchase
3,so far so good thanks lazada
3,really Inc
3,junior high school stuff thx lazada cute cute shape haven't tried yet hope it lasts
3,good item packing nok sent according to schedule copa file won't open exel file corrupted usb terra thesis no hope it will last amen
3,I hope you can hold on
3,item according to the picture sent
3,"good stuff, packaging doesn't use wood, bubble wrap. When the box is opened, the foam is broken. Check the item. Disappointed. The lazada system is installments. Trying to reinstall the CS app twenty times doesn't make it frustrating, the price is skewed, does it make you pay in full?"
3,"duh, how cute is it, how come it's gb?"
3,"alhamdulillah, the goods received, the date of the afternoon knot sent, the calculation of the lead time, fortunately cs lazada and ninja xpress confirmation of the status of the goods position update and the transit warehouse, the date of the change in the status of the goods from the warehouse, sorting transit, ninja xpress, friendly delivery courier, dtrima, bubble wrap, functional goods, only received goods, stuck pixel and worry about whether the soft panel screen color is left re-adjust to taste easy menu interface smooth youtube sound"
3,"the item is neat, it's a shame I didn't install the sim card, how about returning"
3,it just doesn't arrive tb gb
3,"download, don't install it"
3,item received try screen problem screen crashes clear it feels like it's crashing back courier goods j t pay for packing wood goods received please confirm good solution thanks lazada
3,"The quality of the original Samsung, dear, is honest, according to the description of the long model advertisement"
3,"it's good, unfortunately the cleaner doesn't match the picture, where is the brush, in fact, the cotton buds are good, thanks for the review, refuse"
3,"good stuff according to the real usb transfer rate, mb s prefix usb"
3,no file folder for encryption
3,"Super fast delivery, original item"
3,shrill sound volume should be heard or not all movies read external hdd pictures can sound or not
3,package received expedition constraints send week confirmation status
3,"windows is installed, just use say say"
3,if the bale shop is home credit
3,if installment how to pay
3,order goods problem goods according to order
3,order vitron ltv came vitron ltv thank you
3,neat goods quickly please examine the defective goods fortunately used
3,"the laptop likes to save capacity, the laptop's local disk, local disk c, the laptop turns off when you log in, enter the desktop, a black image appears, the pointer behaves"
3,sen flasdisk dpet memory how can ceeee be able to return or not nech it's annoying to wait for it to take a long time to get it it's not as satisfying as in hadeeech
3,send the gb file to the clock
3,"Friendly courier, not friendly, slow response, good HDD, no bonuses, friends"
3,items according to message bonus picture bonus also complete normal delivery not fast not slow also minus packing neat items box suck total item hard disk bonus otg popsocket pounch pack nice sucker torn open kyk second item open
3,price function item
3,
3,"keeeereenn, it's really fast, the TV is good, the sound is clear, thanks, I hope it lasts, the ninja courier is friendly"
3,pretty good save the data file keti
3,"The TV is really good according to expectations, the sound is clear, the picture quality is like a branded TV, the price is low, only the VIP card is GDA, please confirm u VIP card, hooq, waiting for your answer, OK?"
3,"it's cute, the capacity is big, it's great, it's long to come, it's satisfied"
3,brg hardisk ap casing
3,"When I buy a cheap online laptop, the AT button doesn't write the email symbol, the lazada system, press appears, press appears, the at button is really pegimane, if I return, it passes, qc is disappointed, Asus unloading center"
3,"empty root system appears, must reinstall, pack neatly, seal"
3,if using data transfer the contents of a unique form are good
3,freevheadset
3,cool remote
3,the item has arrived yet to try it's easy it's good
3,stock ha
3,"Bro, do you install Win or not?"
3,"it's a shame the internet service isn't there, no earphones, isn't it?"
3,good
3,"yesterday I served the packing neatly yesterday I bought a seller of sensitive goods, the collision was safe, the seller is okay, I believe in buying, thanks Lazada, I believe in shopping"
3,solid
3,try to save
3,nice item dear thanks process hopefully smooth
3,touch screen huh
3,order goods problem goods according to order
3,goods have checked the goods of the house
3,goods according to the message delivery is slow
3,send
3,"Yesterday's order, wow, was subject to tax, I hope it will be delivered smoothly, the goods are satisfied, forget the price"
3,color match color
3,siip
3,"when you try the flashdisk, the shortcut is from the flashdisk"
3,"good stuff, but when I try to detect the laptop's HDD"
3,"Sunday's goods arrived in remote positions, the GB measurement was pretty good, said according to thin plastic, hopefully it will last, thanks"
3,Antivirus can't be used with a small free pouch
3,package received the contents of the film file
3,"don't use a plug-in adapter, bro"
3,tv message disabled thank you lazada disappointed package service ninja xpress slow shipping mat jogja and java area using ninja xpress services thank you
3,solid
3,sound sometimes
3,"item received, sent very well, thanks lazada"
3,pesan sandisk flash disk cruzer blade gb kirim cruzer switch usb flash drive gb
3,"good stuff, neat packing, come, of course, ok, the goods won't be disappointed"
3,kirim super yourself
3,Quick items packing for tv bezel color not silver tv sometimes the sound disappears empty channel overwrites program channel please help for warranty where for normal tv control
3,fast stuff dear otg hp pc connection function
3,"Open, don't disappoint"
3,the processor is not how disappointed
3,by laptop gk cd y
3,"good stuff, the color is different from blue pes"
3,"The second product is pretty good for sending goods, but it's annoying when you send it, you have to take it"
3,price quality sd week using tv smoothly using tv lagging watching youtube change side volume quality of product bintang side fly bintang fast delivery neat
3,packing neat safe disappointed not full tb capacity tb capacity still satisfied
3,"yes, it is quite bargain according to the image for the GB hard drive, communication of goods ready for the transaction, I'm disappointed, I'm not disappointed, because I said, bid for the GB hard drive, the price is automatically different, blah, blah, but send the remaining money to replace the flash disk, the wireless mouse, the response is to sell goods."
3,cb test pack ok fast delivery
3,I checked normally
3,"the windows are open, alias the screen function is directly on, press the product power button, return the money, send it back"
3,"Satisfied, good item, good package, friendly courier, when shopping"
3,tv received neat packing antenna problems try using a tv antenna the connection doesn't match tv antenna special jack connect tv antenna please enter
3,sekarep mu dewek mas bonus gb use direct error
3,ok thank you
3,pretty good thanks lazada
3,item received in good condition fast thanks lazada
3,fast delivery good item thanks lazada
3,"Good stuff, fast delivery, but the packaging is great because it's not a problem"
3,selling response product
3,"the item arrived, how come the cell phone didn't order blue dtng red eehhhmmm"
3,item received with lgs function when checking gb yes even though it's empty second hand yes disappointed it's pretty good compared to lumanyun the price is cheaper because the memory is lacking before tq
3,very capacity gb mb
3,buy cod if when can it arrive sunday
3,good item dear slow delivery please send the rate
3,widows
3,I have received the goods. Try not because it's cheap
3,"seriously, bro, it's really cheap"
3,kitkat android
3,send back a message from date to date confused goods slow notification
3,"the goods are okay, the goods are sent quickly, the packing is neat, but the problem is the keyboard, the keyboard doesn't sort the tap, the place is confused, the free headset when I check doesn't exist because it's really cheap, the goods"
3,"it's cheap, hands-free, promise to order people"
3,"nice clear picture, full HD resolution, shrill mono audio quality, doesn't feel good to the ear, right according to the price"
3,"the cardboard seal has been opened, the wrong pixel, the led is dead, the black dot of the image"
3,too late
3,decent quality as ordered
3,the remote is broken
3,dear usb movie hole usb tigas service guide book service try support disappointed title usb tv out old school tv out as well as feature order thought
3,"I've tried it, it's pretty normal, even though the brg, aka second kcwa, the bottom part is already broken, it can't be tight, it's okay, I can still use it, hopefully it lasts"
3,think closed
3,"thanks sis, the item has arrived, I can't use the flashdisk, I'll try it, I'll give it a star, if it's good, I'll give it a star"
3,item received january wait week received order item received good condition thank you cs patiently serving consumer complaints please be good goods distribution system mesan harbolnas
3,according to the price of good plastic material like plastic glass
3,"May it last, thanks lazada"
3,item okay tech titan activation code expired
3,ok
3,"The goods are safe, the bubbles are torn torn, it makes me disappointed. Estimation of sending. Please send the items estimated."
3,item fast condition thank lazada
3,goods received like hang copy
3,month free vouchers
3,"Ordered Tuesday night, February, March, the goods were sent safely, fast, good quality according to the description, thanks lazada"
3,"the file doesn't open, it doesn't work, it's ok, it's fast, thanks"
3,"good packaging, good stuff, detects the laptop really well, the goods arrive in hand, good overall, thanks lazada"
3,"send the goods quickly, pack the goods neatly, check the capacity of the flash drive according to the GB sen, when you check the GB"
3,forth tv buka silao
3,good quality goods at a cheap price generous save the file very worried key file in edit open
3,"The TV message didn't come with the warranty card, how do I claim the warranty, m"
3,good stuff packaging love you like bubble plastic so it's safe to send
3,"there, trima rda at the time, trima brang neatly wrapped in wood"
3,"I ordered a sharp aquos lc led tv le id, order list, postage, include the exact item, then Rp, I hope Lazada clarifies it"
3,good product because tv error restart re-install again
3,"the goods arrived in condition, thanks, adding to the TV problem, fortunately, it's still a warranty, the exchange process is fast, complicated, sorry, Bintang took the warehouse tolerable"
3,ok
3,good item neat packing screen ok touchscreen ok yesterday installment failed lazada installment ok charge full dri cc
3,"the file opens, I'm disappointed"
3,what date did my item arrive?
3,Siip the goods according to the message
3,stock gk gan
3,"Send quickly, neat packaging, honey, the free bracket is okay, I don't forget"
3,really good stuff good bonus thanks lazada
3,"good, may it last"
3,order arrived because I left the office no order
3,"the goods are okay, how dear, send it on Monday, December, December, packing plastic bubbles, hopefully it will last"
3,how about credit?
3,"Thank you, hopefully it will work with"
3,the delivery package uses a nice wooden box
3,wearable as expected
3,great item arrived safely only courier ninj v makes it annoying slow
3,"I have ordered a money transfer, I ordered the last item, review about the ordered item, instead of writing down the price, the letter price, before the item is printed, please respond fast"
3,"Good packaging, fast delivery, but the hardcase doesn't match the product image, I hope I get the color according to the hard disk, measure a little more"
3,after formatting doesn't detect hard drive turns on warranty
3,order nan until walow too late unfortunately plesdis doesn't use it bad it's really disappointed lazada the product ak ordered doesn't match the picture the message is disappointed
3,"okay, the TV doesn't pack wood, it's super sorry for the expedition"
3,"good quality road tv must be packaged safely because plastic wrap is satisfied. Goods response from cs shop lots, aka reply, please level less"
3,"bomb good stuff, try it"
3,good product packing using bubblewrap not packing wood
3,good fast goods please data cable or not
3,good product according to the description dear sent as promised
3,whoa whoa whoa whoa whoa whoa whoa whoa whoa
3,According to the message additional packing bubble wrap good condition
